{
  "schemaVersion": "1.0",
  "projectId": "autoprompter-project-mode",
  "revision": 1,
  "requiresMultipleAgents": true,
  "rationale": "The work spans persistent state, task scheduling, browser orchestration, repository protocols, review, integration, and recovery, with several independently testable components.",
  "phases": [
    {
      "id": "phase-protocol",
      "title": "Durable project protocol",
      "taskIds": [
        "task-project-schema",
        "task-protocol-tests"
      ],
      "acceptanceCriteria": [
        "Project, plan, task, and result files have versioned schemas.",
        "The sample task graph is acyclic and references only known tasks."
      ]
    }
  ],
  "tasks": [
    {
      "id": "task-project-schema",
      "title": "Define durable project protocol schemas",
      "dependencies": [],
      "role": "documentation",
      "difficulty": "medium",
      "preferredModelClass": "deep"
    },
    {
      "id": "task-protocol-tests",
      "title": "Add protocol invariant tests",
      "dependencies": ["task-project-schema"],
      "role": "testing",
      "difficulty": "medium",
      "preferredModelClass": "standard"
    }
  ],
  "criticalPath": [
    "task-project-schema",
    "task-protocol-tests"
  ],
  "createdAt": "2026-07-31T04:00:00Z"
}
